{
  "schema_version": "1",
  "id": "grammar-oob-story",
  "title": "Out of Bounds Story",
  "title_ja": "テスト",
  "language": "ja",
  "description": "Story with a grammar index that exceeds the grammar list length.",
  "grammar": ["〜です"],
  "vocab_supplement": [],
  "sentences": [
    {
      "id": "s1",
      "words": ["テスト"],
      "ruby": [null],
      "vocab_keys": [null],
      "translation": "Test.",
      "grammar": [99]
    }
  ]
}
