{
  "schema_version": "1",
  "id": "parallel-mismatch-story",
  "title": "Mismatch Story",
  "title_ja": "テスト",
  "language": "ja",
  "description": "Story with parallel array mismatch in ruby.",
  "grammar": ["〜です"],
  "vocab_supplement": [],
  "sentences": [
    {
      "id": "s1",
      "words": ["これ", "は", "テスト"],
      "ruby": [null, null],
      "vocab_keys": [null, null, null],
      "translation": "Test.",
      "grammar": [0]
    }
  ]
}
